ano_implantacao;referencia;nome;bairro;local;rpa;quantidade;vagas;latitude;longitude 
2021;P001;Praça do Arsenal;Recife;Rua do Bom Jesus, oposto a Praça do Arsenal, esquina com Rua Barão Rodrigues Mendes;1;1;2;-8.06135; -34.87105 
2021;P002;Avenida Rio Branco;Recife;Av. Rio Branco, s/n - Recife;1;5;10;-8.06266; -34.87274 
2021;P003;Praça da Independência;Santo Antônio;Av Dantas Barreto, na Praça da Independência, oposto a Igreja Santo Antônio;1;5;10;-8.06423; -34.87839 
2021;P004;Praça Joaquim Nabuco;Santo Antônio;Praça Joaquim Nabuco em frente a Av Floriano Peixoto;1;3;6;-8.06447; -34.88135 
2021;P005;Praça Visconde de Mauá;Santo Antônio;Tv. do Cais da Detenção, s/n - Santo Antônio;1;2;4;-8.06672; -34.88286 
2021;P006;Praça Visconde de Mauá;Santo Antônio;Praça Visc. de Mauá, s/n - Santo Antônio;1;1;2;-8.05618; -34.87823 
2021;P007;Parque Treze de Maio;Boa Vista;Rua da Saudade, oposto ao número 374 e em frente ao Parque Treze de Maio / esquina com Rua Princesa Isabel;1;1;2;-8.05856; -34.88108 
2021;P008;Cinema São Luiz;Boa Vista;Rua Dr. Sebastião Lins, s/n - Boa Vista;1;1;2;-8.06229; -34.88204 
2021;P009;Igreja da Santa Cruz;Boa Vista;Rua da Santa Cruz, s/n - Boa Vista ;1;1;2;-8.06232; -34.88808 
2021;P010;Praça Miguel de Cervantes;Ilha do Leite;Rua Praça Dr Fernando Figueira em frente à Praça Miguel de Cervantes;1;2;4;-8.06532; -34.89368 
2021;P011;Mercado da Encruzilhada;Encruzilhada;Rua Dr. José Maria, s/n - Encruzilhada;2;4;8;-8.03739; -34.89238 
2021;P012;Rua Dona Ana Xavier;Casa Amarela;Rua Dona Ana Xavier, 147 - Casa Amarela;3;1;2;-8.02707; -34.91757 
2021;P013;Mercado de Casa Amarela;Casa Amarela;Rua Padre Lemos, s/n - Casa Amarela;3;4;8;-8.02646; -34.91786 
2021;P014;Largo de Casa Amarela ;Casa Amarela;Largo de Casa Amarela, s/n - Casa Amarela ;3;2;4;-8.02651; -34.91867 
2021;P015;Mercado da Madalena;Madalena;Rua Real da Torre, s/n - Madalena;4;4;8;-8.05237; -34.90885 
2021;P016;Praça Eça de Queiroz;Madalena;R. Des. Luís Salazar/ Esquina com Av. Visc. de Albuquerque;1;1;2;-8.0509; -34.90665 
2021;P017;Escola Waldemar de Oliveira ;Santo Amaro ;Avenida Mario Melo, s/n - Santo Amaro;1;2;4;-8.05496; -34.88021 
2021;P018;Calçada Dom Vital ;São José;Praça Dom Vital, s/n (calçada) - São José ;1;4;8;-8.0679; -34.87812 
2021;P019;Avenida Beberibe;Água Fria ;Avenida Beberibe, 2047 - Água Fria (ponto separados ao longo da via);2;4;8;-8.0193; -34.89408 
2021;P020;Orla de Brasília Teimosa;Brasilia Teimosa;Avenida Brasília Formosa, 1078 - Brasília Teimosa;6;2;4;-8.08102; -34.87676 
2021;P021;Escola Municipal Arraial Novo do Bom Jesus ;Cordeiro ;Estr. do Forte do Arraial Novo do Bom Jesus, 1340 - Cordeiro;4;2;4;-8.05895; -34.93158 
2021;P022;Praça da Várzea;Várzea;Av. Afonso Olindense x Praça Pinto Dâmaso;6;4;8;-8.04876; -34.95968 
2021;P023;Mercado de Afogados ;Afogados ;Estrada dos Remédios, 162 - Afogados ;5;5;10;-8.07822; -34.90691 
2021;P024;Praça Mauriceia;Ipsep;Rua Araçatuba, na Praça Mauricéia;2;4;8;-8.10809; -34.9165 
2021;P025;Mercado da Boa Vista;Boa Vista ;Rua da Santa Cruz, 136 - Boa Vista ;1;2;4;-8.06316; -34.88863 
2021;P026;Praça da Convenção ;Beberibe;Rua Uriel de Holanda, s/n - Beberibe;2;5;10;-8.00266; -34.89772 
2021;P027;Praça Noel Rodrigues;San Martin;Praça Noel Rodrigues. Rua Gui Bastos Júnior/ esquina com Rua Comendador Franco Ferreira;1;3;6;-8.06679; -34.92732 
2021;P028;Pátio do Carmo;Santo Antônio;Av. Dantas Barreto esquina com Rua São Pedro;1;2;4;-8.06643; -34.87938 
2021;P029;Rua da Palma;Santo Antônio;Rua Matias de Albuquerque com Rua da Palma;1;1;2;-8.0636; -34.88021 
2021;P030;Orla de Boa Viagem - Quadras;Boa Viagem;Avenida Boa Viagem, 956, Orla de Boa Viagem - próximo das quadras de tênis;6;4;8;-8.10014; -34.88453 
2021;P031;Parque Dona Lindú 01;Boa Viagem;Parque Dona Lindú 01 -proximo a pista de skate;6;5;10;-8.14095; -34.90398 
2021;P032;Parque Dona Lindú 02;Boa Viagem;Parque Dona Lindú 02 - Rua Setubal;6;2;4;-8.14209; -34.90449 
2021;P033;Orla do Pina - JCPM;Pina;Orla do Pina - Próximo ao JCPM - Av. Antonio de Góes;6;4;8;-8.09084; -34.88174 
2021;P034;Orla do Pina 01;Pina;Orla do Pina - Próximo a rua Ondina;6;4;8;-8.09421; -34.88259 
2021;P035;Orla do Pina 02;Pina;Orla do Pina - Próximo a pista de Skate - Na frente do Lote 674;6;4;8;-8.09761; -34.88343 
2021;P036;Orla de Boa Viagem - 2º Jardim;Boa Viagem;Orla de Boa Viagem - 2º Jardim;6;4;8;-8.10526; -34.88729 
2021;P037;Orla de Boa Viagem - Parque Dona Lindu;Boa Viagem;Orla de Boa Viagem, na frente do Parque Dona LIndu;6;4;8;-8.14224; -34.90363 
2021;P038;Orla de Boa Viagem - R. Bruno Veloso;Boa Viagem;Orla de Boa Viagem - Próximo a rua Bruno Veloso;6;4;8;-8.12202; -34.89596 
2021;P039;Orla de Boa Viagem - EDF. ACAIACA;Boa Viagem;Orla de Boa Viagem - Próximo a rua Felix da Brito e Melo;6;4;8;-8.11863; -34.89409 
2021;P040;Orla de Boa Viagem - Padaria Boa Viagem;Boa Viagem;Orla de Boa Viagem - Próximo a rua Pe Bernadino Pessoa;6;4;8;-8.11539; -34.89212 
2021;P041;Mercado de Água Fria / Beberibe;Água Fria;Na entrada do Mercado de Água Fria / Beberibe;2;13;26;-8.01988; -34.89453 
2021;P042;Mercado do Cordeiro;Cordeiro;Na entrada do Mercado do Cordeiro;4;14;28;-8.0517; -34.92125 
2021;P043;Parque Caiara;Iputinga;Na entrada do Parque Caiara;4;17;17;-8.03861; -34.92838 
2021;P044;Policlínica Professor Waldemar de Oliveira;Santo Amaro;Policlínica Professor Waldemar de Oliveira;1;8;16;-8.07097; -34.88157 
2021;P045;Praça Vidal Negreiros;São José;Praça Vidal Negreiros;1;5;10;-8.05888; -34.87245 
2021;P046;Praça Tiradentes 01;Recife;Praça Tiradentes - na Tv. Tiradentes próximo ao Cais do apolo;1;10;20;-8.05907; -34.8718 
2021;P046;Praça Tiradentes 02;Recife;Praça Tiradentes - Rua do Brum;1;10;20;-8.05907; -34.8718 
2021;P047;Cais Alfândega;Recife;Cais Alfândega - Acesso do shopping em frente aRua da livraria Jaqueira ;1;5;10;-8.06514; -34.87412 
2021;P048;Paço Alfândega;Recife;Paço Alfândega;1;6;12;-8.06516; -34.87361 
2021;P049;Rua da Guia;Recife;Rua da Guia;1;6;12;-8.06173; -34.87191 
2021;P050;Rua do Bom Jesus;Recife;Rua do Bom Jesus;1;5;10;-8.06163; -34.87114 
2021;P051;Rua Domingos José Martins;Recife;Rua Domingos José Martins;1;6;12;-8.06179; -34.87161 
2021;P052;Rua do Observatório;Recife;Rua do Observatório;1;8;16;-8.06051; -34.87209 
2021;P053;Rua Senador José Henrique;Ilha do Leite;Rua Senador José Henrique;1;3;6;-8.06515; -34.89595 
2021;P054;Orla de Boa Viagem - Barão de Souza Leão;Boa Viagem;Avenida Boa Viagem, 4988 - Próximo a pracinha de Boa Viagem;3;4;8;-8.13286; -34.90016 
2021;P055;Rua Gen. José Semeão;Boa Vista;Rua do Lazer;1;5;10;-8.05523; -34.88657 
2021;P056;Mercado Madalena;Madalena;Mercado Madalena;4;5;10;-8.05256; -34.90887 
2021;P057;Senai;Santo Amaro;Senai - Na Av. Norte Miguel Arraes;1;26;52;-8.04695; -34.8779 
2021;P058;Av. Beira Rio;Graças;Av. Beira Rio;4;5;10;-8.04672; -34.90416 
2021;P059;Palácio do Governo do Recife;Santo Antônio;Praça da República, S/N;1;3;6;-8.06042; -34.87722 
2021;P060;Parque 13 de Maio;Boa Vista;Parque 13 de Maio;1;5;10;-8.05649; -34.88254 
2021;P061;Avenida Conde da Boa Vista;Boa Vista;Avenida Conde da Boa Vista - próximo a rua da aurora;1;6;12;-8.06186; -34.88175 
2021;P062;Avenida Conde da Boa Vista;Boa Vista;Avenida Conde da Boa Vista - próximo a rua da saudade;1;6;12;-8.06133; -34.88288 
2021;P063;Shopping Boa Vista;Boa Vista;Shopping Boa Vista - na avenida conde da boa vista;1;6;12;-8.05914; -34.88741 
2021;P064;URB;Boa Vista;URB - na avenida conde da boa vista;1;6;12;-8.05839; -34.88861 
2021;P065;Fafire;Boa Vista;Fafire - na avenida conde da boa vista;1;6;12;-8.05801; -34.88937 
2021;P066;ABRE;Boa Vista;ABRE - na avenida conde da boa vista;1;6;12;-8.05659; -34.89244 
2021;P067;Parque da Macaxeira;Macaxeira;Parque da Macaxeira;3;34;34;-8.01563; -34.9324 
2021;P068;Sítio da Trindade;Casa Amarela;Sítio da Trindade;3;5;10;-8.02852; -34.91169 
2021;P069;Parque Santana;Santana;Parque Santana, próximo a entrada;3;26;26;-8.04105; -34.91729 
2021;P070;Praça Barão de Caiara;Santana;Praça Barão de Caiara;3;11;11;-8.03877; -34.91145 
2021;P071;Compaz Governador Eduardo Campos;Linha do Tiro;Compaz Governador Eduardo Campos;2;10;10;-8.01043; -34.90274 
2021;P072;Parque da Jaqueira;Jaqueira;Parque da Jaqueira;3;2;4;-8.03671; -34.90451 
2021;P073;Parque da Jaqueira Academia Recife;Jaqueira;Parque da Jaqueira Academia Recife;3;5;10;-8.03744; -34.90579 
2021;P074;Mercado da Encruzilhada;Encruzilhada;Mercado da Encruzilhada;2;2;4;-8.03722; -34.89214 
2021;P075;Jardim Botânico do Recife;Curado;Jardim Botânico do Recife;1;9;18;-8.07603; -34.96668 
2021;P076;Academia Recife - Praça do ABC;Mustardinha;Rua Jose Bezerra Cavalcante, 44 ;5;4;8;-8.07307; -34.91878 
2021;P077;TI Getúlio Vargas 01;Cordeiro;TI Getúlio Vargas;4;4;8;-8.05051; -34.92119 
2021;P078;Rua da Aurora;Santo Amaro;Rua da Aurora;1;10;20;-8.0553; -34.87718 
2021;P079;Lagoa do Araçá;Imbiribeira;Lagoa do Araçá - proximo a Rua Dr Emilio Ribas;6;5;10;-8.09228; -34.91353 
2021;P080;COMPAZ Escritor Ariano Suassuna;Cordeiro;COMPAZ Escritor Ariano Suassuna;4;2;4;-8.05996; -34.92586 
2021;P081;Praça Sérgio Lorêto;São José;Praça Sérgio Lorêto;1;5;10;-8.07321; -34.88497 
2021;P082;Prefeitura 1;Recife;Prefeitura 1;1;10;20;-8.05383; -34.87265 
2021;P083;Prefeitura 2;Recife;Prefeitura 2;1;10;20;-8.05463; -34.87239 
2021;P084;Centro Esportivo Santos Dumont;Boa Viagem;Centro Esportivo Santos Dumont;6;5;10;-8.13101; -34.90855 
2021;P085;Fórum Desembargador Rodolfo Aureliano;Joana Bezerra;Fórum Desembargador Rodolfo Aureliano;1;10;20;-8.07109; -34.89438 
2021;P086;Cais do Imperador;Santo Antônio;Cais do Imperador;1;7;14;-8.06516; -34.87617 
2021;P087;Mamede Simões;Santo Amaro;Rua Mamede Simões, 144;1;7;14;-8.05782; -34.88012 
2021;P088;Parque 13 de Maio;Boa Vista;Parque 13 de Maio;1;8;8;-8.05672; -34.88196 
2021;P089;Sede CTTU;Santo Amaro;Av. Cruz Cabugá, 301 - Santo Amaro;1;5;10;-8.05152; -34.87976 
2022;P090;Redesenho - Rua das Oficinas;Pina;Rua das Oficinas - Na frente da escola ;6;3;6;-8.0848; -34.88406 
2021;P091;EREM João Bezerra;Brasília Teimosa; Rua Francisco Valpassos, s/n - Brasília Teimosa;6;10;20;-8.08599; -34.88287 
2021;P092;Praça de Jardim São Paulo 01;Jardim São Paulo;Praça de Jardim São Paulo, Próximo a Delegacia;5;5;10;-8.08165; -34.93874 
2021;P093;Praça do Engenho do Meio;Engenho do meio;R. Antônio Curado, na entrada da Praça;4;5;10;-8.05737; -34.94213 
2021;P094;Academia da Cidade de Campo Grande;Campo Grande;Avenida Agamenon Magalhães, Academia da Cidade de Campo Grande;2;4;8;-8.03778; -34.87584 
2021;P095;Praça do Rosarinho;Rosarinho;Av. Norte Miguel Arraes de Alencar, localizado na entrada da Praça;2;5;10;-8.03307; -34.89663 
2021;P096;Praça do Derby;Derby;Praça do Derby, no lado oposto aos lotes 109 e 85 ;3;5;10;-8.05593; -34.8992 
2022;P097;Soledade;Soledade;R. da Soledade, ao lado da estação TeamBici PE;1;5;10;-8.05797; -34.88988 
2021;P098;Upinha CHIÉ;Santo Amaro;Avenida Agamenon Magalhães, Pista local;1;5;10;-8.03729; -34.87419 
2022;P099;AVENIDA GUARARAPES 01 (Canteiro);Santo Antônio;Avenida Guararapes, no canteiro, do lado oposto aos correios;1;3;6;-8.06269; -34.88023 
2022;P099;AVENIDA GUARARAPES 02 (Correios);Santo Antônio;Avenida Guararapes, no canteiro em frente aos correios correios;1;2;4;-8.06269; -34.88023 
2022;P100;AVENIDA GUARARAPES 03 (Canteiro);Santo Antônio;Avenida Guararapes, no canteiro em frente ao Edifício Trianon - Uninassau/SerEducacional;1;5;10;-8.06284; -34.88021 
2022;P101;Teatro do Parque 01;Boa Vista;Rua do Hospício – Boa Vista;1;3;6;-8.06208; -34.88472 
2022;P101;Teatro do Parque 02;Boa Vista;Rua do Hospicio - Boa Vista;1;2;4;-8.06208; -34.88472 
2022;P102;UPE/Reitoria;Santo Amaro;Avenida Gov. Agamenon Magalhães;1;5;10;-8.04364; -34.88637 
2022;P103;Praça de Parnamirim;Parnamirim;Praça Dr. Lula Cabral de Melo, 448;3;5;10;-8.03323; -34.91013 
2022;P104;Canal do Cavouco 01 ;Iputinga;Rua Prof. Coelho de Almeida, 65 ;4;5;10;-8.04531; -34.93158 
2022;P105;Praça da Torre;Torre;Praça Professor Barreto Campelo;4;5;10;-8.04648; -34.91374 
2022;P106;Parque da Macaxeira ;Macaxeira;Avenida Norte - Dentro do parque, próximo a Academia Recife;3;5;10;-8.01648; -34.93218 
2022;P107;Pátio Santa Cruz ;Boa Vista;Rua Velha, em frente a Igreja de Santa Cruz;1;5;10;-8.06218; -34.88799 
2022;P108;Praça do Hipódromo/Academia Recife;Hipódromo;Rua Fonseca Oliveira - Praça do Hipódromo;2;5;10;-8.03196; -34.88695 
2022;P109;USF Alto do Capitão/ Academia da Cidade 01 ;Dois Unidos;Rua do Campo, 79;2;3;6;-7.99989; -34.91407 
2022;P109;USF Alto do Capitão/ Academia da Cidade 02 ;Dois Unidos;Rua Tupiraçaba, 1368;2;2;4;-7.99989; -34.91407 
2023;P110;Academia Recife - Polo Santo Amaro;Santo Amaro;Avenida Governador Agamenon Magalhães, 20 - Santo Amaro;1;5;10;-8.04454; -34.88805 
2022;P111;Academia da Cidade - Polo Santo Amaro;Santo Amaro;Avenida Governador Agamenon Magalhães, 1286 - 90A na frente da Assembléia de Deus ;1;5;10;-8.03952; -34.87756 
2022;P112;Academia Recife e da Cidade - Polo Coque ;Joana Bezerra;Rua Água Doce, Próximo a academia Recife;1;5;10;-8.06989; -34.89705 
2022;P113;Rua da Palma 02;Santo Antônio;Rua da Palma;1;2;4;-8.06406; -34.88034 
2023;P114;Academia Recife - Polo Água Fria ;Porto da Madeira;Rua Arão Bloter, 90 ;2;5;10;-8.00941; -34.88892 
2022;P115;Academia Recife - Polo Casa Amarela 01;Casa Amarela;Rua Marino de Melo Berenguer, 5673;3;3;6;-8.02215; -34.91583 
2022;P115;Academia Recife - Polo Casa Amarela 02;Casa Amarela;Rua Marino de Melo Berenguer, 5673;3;2;4;-8.02215; -34.91583 
2022;P116;Academia da Cidade - Polo Cajueiro;Campina do Barreto;Rua Coronel Urbano Ribeiro de Sena, 900;2;2;4;-8.01394; -34.8831 
2022;P116;Academia da Cidade - Polo Cajueiro;Campina do Barreto;Rua Coronel Urbano Ribeiro de Sena, 900;2;3;6;-8.01394; -34.8831 
2022;P117;Praça do ABC 01;Mustardinha;Avenida Manoel Gonçalvez da Luz, 821;5;2;4;-8.07331; -34.91862 
2022;P117;Praça do ABC 02;Mustardinha;Avenida Manoel Gonçalvez da Luz, 821;5;3;6;-8.07331; -34.91862 
2022;P118;Academia Recife - Polo Barro;Barro;Rua Otacílio Pessoa, 97 ;5;5;10;-8.08944; -34.94037 
2022;P119;Academia da Cidade Polo Roda de Fogo ;Torrões;Rua Pedro Sá, 105;4;5;10;-8.0579; -34.93716 
2022;P120;Academia Recife - Polo Lagoa do Araçá;Imbiribeira;Rua Nova Verona, N. 87;6;3;6;-8.09643; -34.91544 
2023;P120;Academia Recife - Polo Lagoa do Araçá;Imbiribeira;Rua José Nogueira, N. 20;6;2;4;-8.09643; -34.91544 
2023;P121;Largo da Encruzilhada;Encruzilhada;Praça Largo da Encruzilhada, 59;3;5;10;-8.03741; -34.89152 
2023;P122;Geraldão;Imbiribeira;Entrada principal do Geraldão 02 - sentido cidade;6;3;6;-8.11676; -34.91295 
2022;P122;Geraldão;Imbiribeira;Entrada principal do Geraldão 01 - sentido cidade;6;3;6;-8.11676; -34.91295 
2022;P123;Academia Recife - Polo Engenho do Meio;Engenho do meio;Rua Manuel Alves Deus Dara, 315;4;5;10;-8.05791; -34.94337 
2023;P124;IFPE;Curado;Avenida Professor Luiz Freire, 500 - Próximo a entrada do IFPE;4;5;10;-8.05869; -34.94938 
2022;P125;Academia da Cidade Polo Praça do Poeta;Iputinga;"Avenida Caxangá – Próximo ao Caxangá
Golfe Clube";4;5;10;-8.03447; -34.95031 
2022;P126;Antônio Falcão;Boa Viagem;Avenida Boa Viagem, 3080;6;4;8;-8.11687; -34.89299 
2022;P127;Praça Doutor Fernando Figueira;Ilha do Leite;Praça Dr. Fernando Figueira, lado oposto do empresarial Cervantes, 30;1;5;10;-8.06517; -34.89337 
2023;P128;Praça de San Martin;San Martin;Dentro da Praça de San Martin;5;5;10;-8.07086; -34.92875 
2022;P129;Praça do Trabalho;Casa Amarela;Praça do Trabalho, 33;3;5;10;-8.02317; -34.91453 
2022;P130;Praça Melvin Jones;Parnamirim;Rua Padre Roma;3;5;10;-8.03292; -34.90725 
2022;P131;Frei Cassimiro 01;Santo Amaro;Rua Frei Cassimiro - próximo a praça Márcio Alves;1;5;10;-8.04607; -34.88103 
2023;P132;Encruzilhada / Av. Norte;Encruzilhada;Avenida Beberibe, próximo ao Banco Bradesco da Encruzilhada;2;5;10;-8.03834; -34.89196 
2022;P133;Morro da Conceição;Morro da Conceição; Rua do Morro da Conceição, 361;3;5;10;-8.01951; -34.91505 
2022;P134;Joana Bezerra ;Joana Bezerra;Na frente da Usf - São José do Coque ;1;5;10;-8.07297; -34.89613 
2022;P135;Academia da Cidade - Polo San Martin;San Martin;Av. General San Martin - Praça Noel Rodrigues;2;5;10;-8.06702; -34.92762 
2022;P136;Rua da Saudade;Santo Amaro;Rua da Saudade, próximo a Rua Mamede Simões;1;5;10;-8.05736; -34.88041 
2022;P137;Sudene / Lindolfo Color;Cidade Universitária;R. Lindolfo Color, S/N ;4;4;8;-8.05141; -34.94492 
2023;P138;Colégio Apoio Recife;Casa Amarela;Rua Jouberte de Carvalho, Próximo a entrada do agua Viva Club;3;5;10;-8.0299; -34.91376 
2021;P139;Escola Municipal Engenheiro Umberto Gondim;Pina;R. das Oficinas, 13 - Pina, Recife;6;5;10;-8.08477; -34.88401 
2022;P140;Academia da Cidade Polo Lagoa do Araçá;Imbiribeira;Avenida José Ferreira Lins, 425;6;5;10;-8.09605; -34.9139 
2023;P141;Creche Municipal Menino Jesus da Bomba Grande;Cordeiro; Rua Nossa Senhora da Saúde, 669;4;5;10;-8.04181; -34.92789 
2023;P142;Rua do Futuro;Jaqueira;Rua do Futuro - (redesenho);3;3;6;-8.03625; -34.90384 
2022;P142;Rua do Futuro;Jaqueira;Rua do Futuro - Lado esquerdo da entrada;3;2;4;-8.03625; -34.90384 
2022;P143;Parque Arraial Novo do Bom Jesus;Torrões;Estr. do Forte do Arraial Novo do Bom Jesus 1277;4;5;10;-8.05721; -34.93079 
2023;P144;Campo do Quinze;Torrões;Estr. do Forte do Arraial Novo do Bom Jesus 1133;4;5;10;-8.05829; -34.93132 
2023;P145;Academia da Cidade Polo Vila Um Por Todos;Vasco da Gama;Rua Vila Um Pôr Todos - Próximo a academia da cidade e da quadra ;3;3;6;-8.01033; -34.92239 
2022;P145;Academia da Cidade Polo Vila Um Por Todos;Vasco da Gama;Rua Vila Um Pôr Todos - Próximo as mesa/ playground;3;2;4;-8.01033; -34.92239 
2022;P146;Aurora 01;Boa Vista;Rua da Aurora Proximo a Rua Mamede Simões;1;5;10;-8.05854; -34.87922 
2022;P147; Academia Recife - Polo IPSEP;Ipsep;Rua Dr. Rui Lima Cavalcante 109;6;5;10;-8.11674; -34.9189 
2023;P148;Academia da Cidade Polo Lavadeiras 01; Areias;Rua Goiânia,  26 ;5;3;6;-8.09402; -34.93711 
2023;P148;Academia da Cidade Polo Lavadeiras 02; Areias;Rua Palmares, 47;5;2;4;-8.09402; -34.93711 
2023;P149;Largo Dom Luiz;Vasco da Gama;Largo Dom Luiz,320 ;3;5;10;-8.02077; -34.91729 
2023;P150;Sítio da Trindade;Casa Amarela;Estrada do Arraial - Dentro do Sitio da Trindade próximo a Academia da Cidade e Atras do chalé Trindade Peretti;3;5;10;-8.02903; -34.91212 
2024;P151;Instituto Capibaribe;Graças;Rua das Graças, 30 - lado oposto ao instituto Capibaribe;3;5;10;-8.05032; -34.90177 
2022;P152;Praça Santos Dumont;Ponto de Parada;Praça Santos Dumont - R. José Alexandre Caçador;2;5;10;-8.03056; -34.89481 
2023;P153;Praça Jarbas Pernambucano;Cajueiro;Avenida Sebastião Salazar, 604;2;5;10;-8.011; -34.88365 
2023;P154;Lagoa do Araçá;Imbiribeira;Rua Eng. José Brandão Cavalcante, 816 - Próximo a Santa;6;5;10;-8.09278; -34.91619 
2023;P155;PROCAPE;Santo Amaro;Rua doa Palmares - em frente ao PROCAPE;1;5;10;-8.04956; -34.88758 
2023;P156;Academia da Cidade Polo Praça do Salgueiro;Iputinga;Praça do Salgueiro, lado oposto do lote nº 90;4;3;6;-8.04236; -34.93807 
2023;P156;Academia da Cidade Polo Praça do Salgueiro;Iputinga;Praça do Salgueiro, lado oposto do lote nº 38;4;2;4;-8.04236; -34.93807 
2023;P157;Rua do Livramento;Santo Antônio;Rua do Livramento, 64  - próximo a Loja Tropical.;1;5;10;-8.06659; -34.87772 
2023;P158;Praça do Sebo;Santo Antônio;Próximo a Praça do sebo;1;5;10;-8.063; -34.87881 
2023;P159;Praça Mago Jefferson ;Campina do Barreto;Rua Dr. Elias Gomes 43 ;2;5;10;-8.02106; -34.87954 
2023;P160;Praça Capiba - Cajueiro;Cajueiro;Rua Manoel Brandão;2;5;10;-8.00898; -34.88523 
2023;P161;Praça Onildo Almeida ;Campina do Barreto; Av. Poe. Vinícius de Morais, 349;2;5;10;-8.01855; -34.87942 
2023;P162;Largo da Paz;Afogados;Praça da Paz, nº 68;5;5;10;-8.08061; -34.9063 
2023;P163;Orla de Brasília Teimosa 01;Brasília Teimosa;Av. Brasilia Formosa - Lado oposto ao numero 137;6;5;10;-8.08299; -34.87746 
2023;P164;Orla de Brasília Teimosa 02;Brasília Teimosa;Av. Brasilia Formosa - Próximo ao Quiosque do Cabo e Bar do Peixe;6;5;10;-8.0878; -34.87913 
2023;P165;Orla de Brasília Teimosa 03;Brasília Teimosa;Av. Brasilia Formosa - Lado oposto Quiosque do Seu Jorge;6;5;10;-8.08489; -34.87801 
2023;P166;Praça Caxito (san martin);San Martin;Rua Farroupilha 502;5;5;10;-8.07517; -34.93149 
2023;P167;Prefeitura do Recife;Recife;Cais do Apolo, na frente da prefeitura do Recife;1;5;10;-8.05439; -34.87201 
2023;P168;Praça Jacarezinho;Campina do Barreto;Rua Rifaina 3 - Na frente do mercadinho R.E ;2;3;6;-8.01842; -34.88293 
2023;P169;Academia Recife - Polo praça da Várzea;Várzea;Praça da Varzea;4;5;10;-8.04944; -34.95959 
2023;P170;Praça Jordão Alto;Jordão;Praça Pres. Kenedy 45 ;6;5;10;-8.13429; -34.94147 
2023;P171;Academia da Cidade Polo Jordão;Jordão;Av. Gov. Roberto Silveira 20 -Atrás do Núcleo da Polícia Militar Jordão Baixo;6;3;6;-8.13646; -34.93686 
2023;P171;Academia da Cidade Polo Jordão;Jordão;Av. Doná Carentina;6;2;4;-8.13646; -34.93686 
2023;P172;COMPAZ Dom Helder Câmara;São José;Avenida Central, 92 - Próximo a entrada do prédio.;1;5;10;-8.0736; -34.89538 
2023;P173;COMPAZ Dom Helder Câmara;São José;Avenida Central, 92 - Próximo a entrada de veículos;1;5;10;-8.07351; -34.89551 
2022;P174;SESC de Santo Amaro;Santo Amaro;Praça do Campo Santo - R. do Pombal, perto do Sesc de Santo Amaro;1;5;10;-8.04941; -34.88267 
2022;P175;Academia da Cidade Polo Heróis da Restauração; Areias;Rua Cajá, 47;5;5;10;-8.09717; -34.93571 
2023;P176;Terminal Engenho do Meio;Engenho do meio;Rua Valdemar Falcão, lado oposto ao lote nº 610;4;5;10;-8.0587; -34.94589 
2023;P177;Creche Escola Dep. Alcides Teixeira;Santo Amaro;Av. Norte Miguel Arraes de Alencar, 1193 ;1;2;4;-8.04389; -34.8828 
2024;P177;Creche Escola Dep. Alcides Teixeira;Santo Amaro;Av. Norte Miguel Arraes de Alencar, 1193 ;1;3;6;-8.04389; -34.8828 
2024;P178;Vila do Vintém;Santana;Rua Afonso de Albuquerque Melo;3;2;4;-8.03802; -34.91035 
2024;P178;Vila do Vintém;Santana;Rua Afonso de Albuquerque Melo;3;3;6;-8.03802; -34.91035 
2024;P179;Praça Parque Amorim;Boa Vista;Pista Local da Av. Agamenon Magalhães, atrás da Parada de ônibus - Dentro da Praça;1;5;10;-8.05192; -34.89494 
2024;P180;Praça Souto Filho;Jaqueira;Rua Hoel Sette, próximo a entrada do Parcão;3;5;10;-8.03614; -34.90295 
2024;P181;Praça General Carlos Pinto (Tacaruna);Santo Amaro;Praça General Carlos Pinto, próximo ao shopping tacaruna;1;5;10;-8.03986; -34.87194 
2024;P182;Praça Oswaldo Cruz;Boa Vista;Rua João Fernandes Vieira, lado oposto ao Lote nº 190;1;5;10;-8.05476; -34.89126 
2024;P183;Estação Imbiribeira;Imbiribeira;R. Dr. Valdir Pessoa - Próximo a entrada do metrô;6;5;10;-8.09051; -34.90761 
2024;P184;Estação Mangueira;Afogados;Avenida Central, 2562 – Mangueira;5;5;10;-8.08591; -34.93683 
2024;P185;Estação Ipiranga;Afogados;Avenida Central, 2435 - Em frente a entrada da estação, próximo a Escola Estadual Vidal de Negreiros;5;5;10;-8.0773; -34.91345 
2024;P186;Estação Santa Luzia;Estância;Rua Rocha Pombo – Na praça em frente a entrada da Estação;5;5;10;-8.08426; -34.92992 
2022;P187;Praça Brasilit (Praça do Caxito - Várzea);Várzea;Rua Abatiá, S/N - Várzea;5;5;10;-8.04175; -34.95027 
2024;P188;Praça Bom Partor;Engenho do meio;Rua Bom Pastor, lado oposto ao lote nº 1409.;4;5;10;-8.04925; -34.93978 
2024;P189;Praça Ministro João Gonçalves de Souza;Engenho do meio;Rua Gáspar Pérez, 1011;4;5;10;-8.04795; -34.94344 
2024;P190;Praça do Sena;Areias;Rua Capitão Antônio França, lado oposto ao lote nº113;5;5;10;-8.09594; -34.93344 
2024;P191;Praça VDC;Areias;Rua Capitão Manuel de Aguiar;5;5;10;-8.09489; -34.93236 
2024;P192;Centro POP;Santo Antônio;Av. Martins de Barros, 395 - Na calçada, ao lado da entrada do Centro de Referência;1;5;10;-8.06401; -34.8765 
2024;P193;DER;Santo Amaro;Rua Leão Falcão, 337 - Na calçada do DER ;1;5;10;-8.04573; -34.87587 
2024;P194;Escola Sizenando Silveira;Santo Amaro;Rua do Hospício,999 - próximo ao Parque Treze de Maio.;1;5;10;-8.05454; -34.88186 
2024;P195;Mercado Público Santo Amaro;Santo Amaro;Av. Cruz Cabugá, 1933 - Ao lado da entrada principal do Mercado;1;5;10;-8.04682; -34.87655 
2024;P196;Cais do Sertão 01;Recife;Av. Alfredo Lisboa, armazém 10 – Recife;1;5;10;-8.06124; -34.87045 
2024;P197;Parque Treze de Maio;Boa Vista;Rua Princesa Isabel, 470 - Na entrada do Parque Treze de Maio.;1;5;10;-8.058; -34.88217 
2024;P198;Praça 13 de Maio;Boa Vista;Rua do Hospício,671 - Praça em Frente a Câmara Municipal de Recife.;1;5;10;-8.05717; -34.88303 
2024;P199;Praça Dezessete;Santo Antônio;Rua do Imperador Pedro II - Em frente a Igreja do Divino Espírito Santo.;1;5;10;-8.06523; -34.87688 
2024;P200;Praça Ascenso Ferreira;Recife;Av. Rio Branco, 242 - Em frente ao Banco do Brasil.;1;5;10;-8.06248; -34.8737 
2024;P201;Praça do Pilar;Recife;Av. Alfredo Lisboa, 1052 - Em frente ao terminal marítimo do Recife.;1;5;10;-8.0569; -34.86989 
2024;P202;Praça Onze de Junho;Santo Amaro;Av. Pref. Artur Lima Cavalcanti, 206 - lado oposto do SEINFRA.;1;5;10;-8.04468; -34.87467 
2024;P203;Praça Prof. Agamenon Magalhães;Santo Amaro;Av. Norte Miguel Arraes de Alencar, 1128 - em frente a Paróquia de São Sebastião.;1;5;10;-8.04374; -34.88222 
2024;P204;Cais do Sertão 02;Recife; Av. Alfredo Lisboa, S/N - Recife;1;5;10;-8.0597; -34.86991 
2024;P205;Rua da Moeda (Paço Alfândega);Recife;Rua da Moeda, 170 - Em frente ao shopping Paço Alfândega;1;5;10;-8.06465; -34.87342 
2024;P206;Rua Imperatriz Tereza Cristina (UTEC); Boa Vista;Rua Imperatriz, 182 - na Frente a UTEC;1;5;10;-8.06291; -34.88427 
2024;P207;Rua Matias de Albuquerque;Santo Antônio;Rua Matias de Albuquerque, 252 - de esquina com a Av. Dantas Barreto.;1;5;10;-8.06394; -34.87895 
