ano_implantacao;referencia;nome;bairro;local;rpa;quantidade;vagas;latitude;longitude 
2024;P208;Rua Sete de Setembro;Boa Vista;Rua Sete de Setembro, 42 - próximo a Rua Imperatriz;1;5;10;-8.06277; -34.88378 
2024;P209;Teatro Santa Izabel;Santo Antônio;Praça da República, 222 - Ao lado da Entrada do Teatro Santa Izabel;1;5;10;-8.06086; -34.87812 
2024;P210;Travessa do Arsenal da Guerra;São José;Travessa Arsenal de Guerra, 57 - Travessa que fica por trás da Narciso;1;5;10;-8.06658; -34.87688 
2024;P211;Av. Dantas Barreto (Armarinho Mundial);São José;Av. Dantas Barreto, 981 - Em frente a loja Armarinho e Papelaria Mundial;1;5;10;-8.06916; -34.88115 
2024;P212;Av. Dantas Barreto (Magno Equipamentos);São José;Av. Dantas Barreto, 1153 -  em frente a loja Magno Equipamentos.;1;5;10;-8.07052; -34.88224 
2024;P213;ETE Almirante Soares Dutra;Santo Amaro;Praça General Abreu e Lima, 74 - Em frente a Escola Técnica ETE;1;5;10;-8.04726; -34.87579 
2024;P214;Píer dos Ciclistas ;Santo Antônio;Cais de Santa Rita, 695 - Ao lado do clube de amadores de pesca.;1;5;10;-8.07117; -34.87572 
2024;P215;Praça Sérgio Loreto;São José;Praça Sérgio Loreto, 55 - Ao lado do prédio Esquina do Galo.;1;5;10;-8.07224; -34.88497 
2024;P216;Praça Nelson Ferreira;Santo Amaro;Rua dos Palmares, 162 - Cruzamento com a Rua Palmares x Rua Coelho Leite.;1;5;10;-8.05298; -34.88291 
2024;P217;Rua Duque de Caxias;Santo Antônio;Rua Duque de Caxias, 175 - Em frente a praça da Independência, ao lado da Crefaz.;1;5;10;-8.06401; -34.8765 
2024;P218;Rua Corredor do Bispo;Boa Vista;Rua Corredor do Bispo, 185 - Em frente a ArtFast – Gráfica e Editora.;1;5;10;-8.05761; -34.887 
2024;P219;Liceu/Nóbrega;Santo Amaro;Rua do Príncipe, 526 - Em frente a Escola Liceu/Nóbrega.;1;5;10;-8.05585; -34.88799 
2024;P220;Rua João Fernandes Vieira;Boa Vista;Rua João Fernandes Vieira, 1 - Calçada do Edf. Vita Classic, próximo a Rua Soledade.;1;5;10;-8.05619; -34.89004 
2024;P221;Smartlet;Santo Amaro;Av. Alfredo Lisboa, 578 – Recife;1;5;10;-8.06155; -34.87066 
2024;P222;INSS (Rua dos Palmares);Santo Amaro;"Rua dos Palmares, 343 - na calçada, ao lado do fiteiro na entrada do INSS
";1;5;10;-8.05254; -34.88405 
2024;P223;Praça do Campo Santo (UTEC);Santo Amaro;Avenida da Saudade, 303 - em frente a UTEC, ao lado dos quiosques de alimentação ;1;5;10;-8.05088; -34.88297 
2024;P224;Praça Dom Vital;São José;Praça Dom Vital  - em frente da Igreja, atrás da estátua;1;5;10;-8.06819; -34.87836 
2024;P225;Praça Numa Pompilho;Santo Amaro;Rua Numa Pompilho - na Praça Numa Pompilho, em frente ao lote 48;1;5;10;-8.0479; -34.88305 
2024;P226;Praça Otília;Boa Vista;Av. Gov. Agamenon Magalhães - na esquina com a Rua Monte Castelo e a Rua Montevidéu;1;5;10;-8.04957; -34.89308 
2024;P227;Agência Caixa (Rua Dr. Leopoldo Lins);Boa Vista;Av. Gov. Agamenon Magalhães, 2997 - em frente a Caixa Econômica Federal;1;5;10;-8.04882; -34.89253 
2024;P228;Campo do Onze;Santo Amaro;Av. Dr. Jayme da Fonte - na calçada entre as árvores;1;5;10;-8.04053; -34.87863 
2024;P229;Casa da Cultura;Santo Antônio;Rua Floriano Peixoto - na calçada, ao lado do Quiosque do Tio Aldo;1;5;10;-8.06628; -34.88263 
2024;P230;CEHAB;Campo Grande;Rua Odorico Mendes, 700 - na calçada, entre o portão de acesso e a Rua Nova;2;5;10;-8.03826; -34.8796 
2024;P231;Igreja de São Gonçalo;Boa Vista;Beco São Gonçalo, S/N - na calçada, em frente a Igreja de São Gonçalo;1;5;10;-8.06456; -34.88955 
2024;P232;Igreja de Nossa Sra do Rosário dos Pretos;Santo Antônio;R. Larga do Rosário, 97 -  em frente a Igreja Nossa Senhora do Rosário dos Pretos;1;5;10;-8.06514; -34.87786 
2024;P233;Ministério do Trabalho e Emprego (MTE);Espinheiro;Av. Gov. Agamenon Magalhães, 2000 - próximo a entrada no MTE;3;5;10;-8.043; -34.88729 
2024;P234;Praça Agamenon (Ilha do Joaneiro) ;Campo Grande;Av. Gov. Agamenon Magalhães, próximo a igreja Assembléia de Deus Ilha do Joaneiro;2;5;10;-8.04036; -34.88127 
2024;P235;Quadra Kássio Rinaldo ;Santo Amaro;Av. Gov. Agamenon Magalhães, 185 pista principal - próximo a quadra Kássio Rinaldo;1;5;10;-8.04165; -34.88193 
2024;P236;Praça Aurora ;Boa Vista;R. da Aurora, lado oposto ao lote nº1675  - na calçada, ao lado do Bike-PE;1;5;10;-8.05085; -34.87419 
2024;P237;Quadra de Futsal da Aurora ;Santo Amaro;R. da Aurora, lado oposto ao nº 1147 - entre a quadra de futsal e a pista de skate;1;5;10;-8.05468; -34.87678 
2024;P238;Rua da Moeda (Moedão) ;Recife;R. da Moeda - em frente ao lote nº 88;1;5;10;-8.06456; -34.87263 
2024;P239;Rua do Bom Jesus ;Recife;Rua do Bom Jesus, 188 - na calçada, por trás da Delegacia do Rio Branco;1;5;10;-8.06233; -34.87146 
2024;P240;Rua dos Amores ;Recife;Av. Barbosa Lima, S/N - próximo ao portal da Rua dos Amores;1;5;10;-8.06193; -34.87274 
2024;P241;Escola Municipal Novo Mangue ;Ilha Joana Bezerra;Av. Central, 40  - na lateral da escola;1;5;10;-8.07524; -34.90351 
2024;P242;Praça na Rua Epaminondas de Melo 01;Paissandu;R. Epaminondas de Melo, s/n - na praça, em frente ao Bradesco Prime;1;3;6;-8.06014; -34.8982 
2024;P242;Praça na Rua Epaminondas de Melo 02;Paissandu;R. Epaminondas de Melo, s/n - na praça, em frente ao Bradesco Prime;1;2;4;-8.06014; -34.8982 
2024;P243;Praça Cássia Kiss de Lima ;Ilha Joana Bezerra;R. Caetité, 24 - na praça, em frente ao lote 90;1;5;10;-8.07002; -34.90027 
2024;P244;Praça Dom Bosco 01;Ilha do Leite;R. General Joaquim Inácio, S/N - na praça, em frente a Rua General Joaquim Inácio;1;3;6;-8.06315; -34.89349 
2024;P244;Praça Dom Bosco 02;Ilha do Leite;R. General Joaquim Inácio, S/N - na praça, em frente a Rua Joaquim de Brito;1;2;4;-8.06315; -34.89349 
2024;P245;Praça Jenner de Souza ;Derby;R. Amaro Bezerra, S/N - na praça, entre as árvores, na grama;3;5;10;-8.05484; -34.90028 
2024;P246;Praça na Rua Ibiporã ;Ilha Joana Bezerra;R. Ibiporã, S/N - ao lado do equipamento de exercício, em frente a Rua Centenário do Sul;1;5;10;-8.07254; -34.89974 
2024;P247;Praça na Rua Velha ;Boa Vista;R. Velha S/N - na praça, próximo ao poste de iluminação;1;5;10;-8.06453; -34.88532 
2024;P248;Quadra da Praça Joana Bezerra ;Ilha Joana Bezerra;R. S D 9806, 75 - na praça, por trás da quadra da Praça Joana Bezerra;1;5;10;-8.06911; -34.8972 
2024;P249;Rua Imperatriz Tereza Cristina (SECR) ;Boa Vista;R. Imperatriz Tereza Cristina, 67 - na rua, em frente ao Sindicato (SECR);1;5;10;-8.06327; -34.88305 
2024;P250;Igreja de Nossa Senhora das Fronteiras ;Boa Vista;R. Henrique Dias, S/N - na calçada, entre as árvores;1;5;10;-8.05848; -34.89641 
2024;P251;Rua da Palma;Santo Antônio;R. da Palma, 295 - no redesenho, em frente a loja Millena Móveis;1;3;6;-8.06557; -34.88084 
2024;P251;Rua da Palma;Santo Antônio;R. da Palma, 205 - no redesenho, em frente a loja Ponto de Promoção;1;2;4;-8.06557; -34.88084 
2024;P252;Cais do Sertão;Recife;Av. Alfredo Lisboa, 690 - Na parte do gramado do Cais do Sertão;1;5;10;-8.06083; -34.87033 
2024;P253;Museu Forte do Brum;Recife;Av. Militar, 708 - Em frente ao Forte do Brum, na praça comunidade Luso Brasileira.;1;5;10;-8.05339; -34.87097 
2024;P254;Moinho;Recife;Av. Alfredo Lisboa, 810 - Em frente ao prédio da Accenture.;1;5;10;-8.05894; -34.86983 
2024;P255;Píer (Armazém 14);Recife;Av. Alfredo Lisboa, 135 - Píer próximo ao Armazém 14.;1;5;10;-8.06534; -34.87196 
2024;P256;Píer (FriSabor);Recife;Av. Alfredo Lisboa, 242 - Píer próximo ao FriSabor - atrás do ponto policial;1;5;10;-8.06447; -34.87149 
2024;P257;Seu Boteco;Recife;Av. Alfredo Lisboa, 333 - Próximo ao Marco Zero, na lateral da Entrada do Seu Boteco.;1;5;10;-8.06378; -34.8711 
2024;P258;Smartlet;Recife;Av. Alfredo Lisboa, 578 - Ao lado do equipamento SMARTLET.;1;5;10;-8.0616; -34.87061 
2024;P259;Forte das Cinco Pontas;São José;Praça das Cinco Pontas, S/N - na calçada, em frente a entrada do Museu;1;5;10;-8.07137; -34.88082 
2024;P260;Rua da Carioca;Santo Antônio;R. da Carioca, 72 - no redesenho, ao lado do estacionamento de motos;1;5;10;-8.06724; -34.87689 
2024;P261;Rua do Forte;Santo Antônio;R. do Forte, S/N - na rua, por trás da parada de ônibus;1;5;10;-8.07129; -34.8799 
2024;P262;Catamaran ;São José;Cais Santa Rita, S/N -  no canteiro, entre as árvores;1;5;10;-8.07286; -34.88025 
2024;P263;Praça do Derby;Boa Vista;Avenida Agamenon Magalhães, perto da Agência do  Bradesco - do lado ponto de coleta de lixo;1;5;10;-8.05642; -34.89826 
2024;P264;Pontilhão da Paissandu;Boa Vista;Avenida Agamenon Magalhães, S/N - Em frente ao Banco Safra;1;5;10;-8.06224; -34.89748 
2024;P265;Praça de Joana Bezerra;Ilha Joana Bezerra;Rua Jaraguari, S/N - por trás da parada de ônibus locada na Praça;1;5;10;-8.07037; -34.89652 
2024;P266;Praça em frente a COMPESA;Cabanga;Avenida Saturino de Brito , s/n - Cabanga;1;5;10;-8.07968; -34.89281 
2024;P267;Empório Ferreira;Santo Antônio ;Rua da Praia, 175, Santo Antônio;1;5;10;-8.06816; -34.87713 
2024;P268;Canteiro Central da Rua Othon Paraíso;Torreão;Rua Othon Paraíso, S/N - Torreão;2;5;10;-8.0405; -34.88336 
2024;P269;Parque de Esculturas;Brasília Teimosa;Avenida Brasília Formosa – Brasília Teimosa;6;5;10;-8.06605; -34.87011 
2024;P270;Restaurante Ôge;Boa Vista;Travessa Correia Neto, 573 – Boa Vista;1;5;10;-8.06078; -34.88098 
2024;P271;Liamba;Graças;Rua Fernando Lopes, S/N - Graças;3;5;10;-8.05245; -34.90302 
2024;P272;Canteiro Central da Rua Othon Paraíso;Torreão;Rua Othon Paraíso, S/N - Torreão;2;5;10;-8.03975; -34.88346 
2024;P273;Praça Márcio Condonga;Santo Amaro;Rua dos Palmares, 208, Santo Amaro;1;5;10;-8.04955; -34.8877 
2024;P274;Praça Dalceu;Campo Grande;Av. Prof. José dos Anjos, nº140 - Campo Grande;2;5;10;-8.02424; -34.88168 
2024;P275;Praça do Lindomar;Campo Grande;Rua União dos Palmares - Campo Grande;2;5;10;-8.02554; -34.87651 
2024;P276;Praça Sargento Pincel ;Campo Grande;Rua União dos Palmares, S/N, Campo Grande ;2;5;10;-8.025; -34.87633 
2024;P277;Praça da rotatória ;Campo Grande;Rua Prudente Morais, S/N, Campo Grande;2;5;10;-8.02842; -34.88762 
2024;P278;Praça Ulisses Leon de Oliveira;Hipódromo ;Rua Me. Rosa Gatorno - Hipódromo;2;5;10;-8.02914; -34.88946 
2024;P279;Praça Paulo Bernardo ;Rosarinho;Rua Regueira Costa, s/n - Rosarinho;2;5;10;-8.03233; -34.89842 
2024;P280;Praça Canavial ;Dois Unidos ;Rua Canavial, S/N, Dois Unidos;2;5;10;-8.00087; -34.90162 
2024;P281;USF/ Praça Alto do Capitão;Dois Unidos ;Rua Tupiraçaba, s/n – Dois Unidos;2;5;10;-7.99982; -34.91387 
2024;P282;Escola Estadual Prof. José dos Anjos;Dois Unidos ;Av. Hildebrando de Vasconcelos, nº 2758 – Dois Unidos;2;5;10;-7.98907; -34.91666 
2024;P283;Praça do Fundão ;Fundão ;Av. Beberibe, S/N, Fundão;2;5;10;-8.01403; -34.88946 
2024;P284;Praça USF Irmã Terezinha;Campina de Barreto;Rua Passarela, S/N, Campina de Barreto;2;5;10;-8.02039; -34.87792 
2024;P285;Praça André Antunes;Cajueiro ;Rua Tem. Vanderlei, S/N, Cajueiro ;2;5;10;-8.01287; -34.88304 
2024;P286;Praça na Rua Alice Tibiriçá;Cajueiro ;Rua Alice Tibiriçá, S/N – Cajueiro ;2;5;10;-8.00985; -34.88267 
2024;P287;Praça Amaro Albino Pimentel ;Tamarineira ;Rua Eng. Agamenon Magalhães, s/n – Tamarineira ;3;5;10;-8.03007; -34.89795 
2024;P288;Praça Marcos Bocoiô;Tamarineira ;Rua Alfredo Osório, s/n - Tamarineira;3;5;10;-8.02925; -34.90648 
2024;P289;Mercado da Encruzilhada ;Encruzilhada ;Rua Carlos Borromeu, S/N - Encruzilhada ;2;5;10;-8.03649; -34.89238 
2024;P290;Largo Bomba do Hemetério;Bomba do Hemetério ;Rua Chã de Alegria, 299 – Bomba do Hemetério;2;5;10;-8.02027; -34.9033 
2024;P291;Centro de Saúde Dr. Luiz Wilson;Bomba do Hemetério ;Rua Chã de Alegria, s/n – Bomba do Hemetério ;2;5;10;-8.021; -34.90421 
2024;P292;Praça Sr. Bartolomeu ;Macaxeira;Rua Antônio Batista de Souza - Macaxeira;3;5;10;-8.01779; -34.93282 
2024;P293;Canteiro Central da Avenida José Américo ;Macaxeira;Av. José Américo de Almeida - Macaxeira;3;5;10;-8.01004; -34.93122 
2024;P294;Escola Municipal da Mangabeira;Mangabeira;Rua Nicéas Arco-Verde Gusmão, 287 – Mangabeira;3;5;10;-8.02397; -34.90072 
2024;P295;Praça Vagner Love;Poço da Panela ;Rua Monsenhor Lôbo – Poço da Panela ;3;5;10;-8.03723; -34.92247 
2024;P296;Praça Compositor Antônio Maria ;Santana ;Rua Nestor Silva,  s/n - Santana;3;5;10;-8.04017; -34.91384 
2024;P297;Praça Everaldo Bidou Lambbe;Santana ;Rua Afonso de Albuquerque Melo - Santana;3;5;10;-8.03809; -34.91111 
2024;P298;Praça Flor de Santana;Santana ;Rua Sant’anna, 1057 - Santana;3;5;10;-8.03804; -34.91793 
2024;P299;Praça Elvira de Souza;Graças;Rua Senador Alberto Paiva, 98 - Graças;3;5;10;-8.04382; -34.90148 
2024;P300;Praça Marcelino Champagnat;Graças;Rua Paulino Gomes de Souza, s/n - Graças;3;5;10;-8.04182; -34.90054 
2024;P301;Mercado da Encruzilhada (Belém);Encruzilhada ;Rua Amaro Coutinho, S/N - Encruzilhada;2;5;10;-8.04182; -34.90054 
2024;P302;Praça Otávio de Freitas;Derby;Rua Jener Souza, s/n - Derby;3;5;10;-8.05796; -34.90058 
2024;P303;Praça Jorn. Francisco Pessoa de Queiroz;Parnamirim ;Praça Jorn. Francisco Pessoa de Queirós Jr - Parnamirim;3;5;10;-8.03702; -34.91399 
2024;P304;Praça do Monteiro ;Parnamirim ;Avenida Dezessete de Agosto, s/n - Parnamirim;3;5;10;-8.02789; -34.92838 
2024;P305;Quadra do Vasco ;Vasco da Gama ;Rua Catingua, s/n – Vasco da Gama;3;5;10;-8.01257; -34.92122 
2024;P306;Praça Deputado Fabio Correa;Alto José do Pinho;Praça Deputado Fabio Correa;3;5;10;-8.02237; -34.90633 
2024;P307;Calçada da Av. João de Barros ;Encruzilhada ;Av. João de Barros, 1858 - Encruzilhada;2;5;10;-8.03832; -34.89194 
2024;P307;Calçada da Av. João de Barros ;Encruzilhada ;Av. João de Barros, 1858 - Encruzilhada;2;5;10;-8.03832; -34.89194 
2024;P308;Praça Desenhista Eulino Santos;Arruda;Rua Desenhista Eulino Santos, S/N - Arruda;2;5;10;-8.02278; -34.88309 
2024;P309;Praça Josélia;Nova Descoberta;Avenida Josélia nº 234 - Nova Descoberta;3;5;10;-8.00283; -34.92669 
2024;P310;USF Prof. Antônio Francisco Areias;Campo Grande;Av. Prof. José dos Anjos, 506 - Campo Grande;2;5;10;-8.02185; -34.8771 
2024;P311;Campo Campina de Barreto;Campina de Barreto;Rua Cel. Mário Libório – Campina do Barreto;2;5;10;-8.01667; -34.88142 
2024;P312;Praça de Vinte de Julho;Campo Grande;Rua Cirilino Afonso de Melo, s/n -  Campo Grande.;2;5;10;-8.02558; -34.87912 
2024;P313;Academia da Cidade Polo Torreão;Torreão;Av. Gov. Agamenon Magalhães - Torreão;2;5;10;-8.04122; -34.88314 
2024;P314;Praça Castro Alves;Torreão;Av. Norte, s/n -Torreão;2;5;10;-8.03981; -34.88713 
2024;P315;Praça Josenildo Lins;Casa Amarela ;Rua Arnoldo Magalhães, s/n - Casa Amarela;3;5;10;-8.02666; -34.90936 
2024;P316;Secretaria Executiva de Vigilência em Saúde SEVS;Santo Amaro;Av. Visconde de Suassuna, 658 – Santo Amaro;1;5;10;-8.0515; -34.88703 
2024;P317;Praça do Hipódromo;Hipódromo ;Rua Fonseca Oliveira, s/n - Hipódromo;2;5;10;-8.03196; -34.88647 
2024;P318;Parque de Apipucos;Apipucos;Rua Apipucos, S/N – Apipucos;3;5;10;-8.02162; -34.93318 
2024;P319;Praça de Apipucos ;Apipucos;Rua Apipucos, S/N – Apipucos;3;5;10;-8.02109; -34.93407 
2024;P320;Escola Embaixador Gilberto Amado ;Hipódromo ;Rua Gáspar Regueira, SNº - Hipódromo;2;5;10;-8.03271; -34.8877 
2024;P321;Praça Maria da Conceição de Barros ;Porto da Madeira;Avenida Aníbal Benévolo, na praça - Porto da Madeira;2;5;10;-8.0082; -34.89415 
2024;P322;Praça Newton Vaz;Arruda;Rua Ramiz Galvão, S/N – Arruda;2;5;10;-8.02513; -34.89392 
2024;P323;Praça Maria José dos Santos ;Água Fria ;Rua Exp Jamil Dágle, 146- Água Fria;2;5;10;-8.0342; -34.91154 
2024;P324;Praça Dr. José Vilela 01;Parnamirim ;Avenida Dezessete de Agosto, Parnamirim;3;5;10;-8.03761; -34.91029 
2024;P325;Praça Dr. José Vilela 02;Parnamirim ;: Avenida Dezessete de Agosto, s/n - Parnamirim;3;5;10;-8.0342; -34.91154 
2024;P326;Quadra do Viaduto João Tude Melo ;Santana ;Rua Dr. João Santos Filho, S/N-  Santana;3;5;10;-8.03761; -34.91029 
2024;P327;Praça Augusto Rodrigues;Torreão;Rua Augusto Rodrigues , 174  - Torreão ;2;5;10;-8.03925; -34.88512 
2024;P328;Campo de Concentração de Treinamento de Futebol Internacional do Brasil;Vasco da Gama ;Rua Frei Martinho, s/n – Vasco da Gama ;3;5;10;-8.01031; -34.92224 
2024;P329;Praça de Campo Grande ;Campo Grande;Estrada de Belém, s/n – Campo Grande;2;5;10;-8.03243; -34.87733 
2024;P330;Estádio do Arruda;Arruda;Rua das Moças, s/n – Arruda;2;5;10;-8.02613; -34.89272 
2024;P331;Praça Paulo Freire;Torre ;Rua Antônio Rabelo, s/n – Torre;4;5;10;-8.04986; -34.90499 
2024;P332;Praça Domingos Giovanetti;Torre;Avenida Beira Rio, s/n – Torre;4;5;10;-8.04738; -34.90433 
2024;P333;Praça José da Mota Silveira;Madalena ;Rua Arlindo Gouveia, s/n – Madalena ;4;5;10;-8.05631; -34.9038 
2024;P334;Praça Gregório Bezerra;Torre;Rua Cantora Clara Nunes, s/n – Torre;4;5;10;-8.04478; -34.91533 
2024;P335;Praça Batista da Silva;Torre;Rua José Bonifácio, s/n – Torre;4;5;10;-8.04247; -34.90833 
2024;P336;Praça Dom José Pereira Alves;Cordeiro;Rua Dom José Pereira Alves, s/n – Cordeiro;4;5;10;-8.04924; -34.92534 
2024;P337;Praça Áureo Xavier ;Cordeiro;Rua Áureo Xavier, s/n – Cordeiro;4;5;10;-8.05005; -34.92689 
2024;P338;COMPAZ Escritor Ariano Suassuna;Cordeiro;Avenida General San Martin, 1208, s/n – Cordeiro;4;5;10;-8.05956; -34.92603 
2024;P339;COMPAZ Escritor Ariano Suassuna;Cordeiro;Avenida General San Martin, 1208, s/n – Cordeiro;4;5;10;-8.06; -34.92605 
2024;P340;COMPAZ Escritor Ariano Suassuna;Cordeiro;Avenida General San Martin, 1208, s/n – Cordeiro;4;5;10;-8.05994; -34.92624 
2024;P341;Praça da Fé;Cordeiro;4º Travessa Alexandre de Gusmão, s/n – Cordeiro;4;5;10;-8.05624; -34.92732 
2024;P342;Praça da Paz Arcebispo Dom Helder Câmara;Torrões;Rua Dr. Domingos de Abreu Vasconcelos, S/N - Torrões;4;5;10;-8.0669; -34.93337 
2024;P343;Praça Luiz Gonzaga ;San Martin ;Rua Leila Félix Karam, S/N – San Martin;5;3;6;-8.06513; -34.93201 
2024;P343;Praça Luiz Gonzaga ;San Martin ;Rua Leila Félix Karam, S/N – San Martin;5;2;4;-8.06513; -34.93201 
2024;P344;Praça da Chesf;Torrões;Av. Eng. Abdias de Carvalho, S/N – Torrões;4;5;10;-8.06279; -34.93102 
2024;P345;Praça do Berardo ;Madalena ;Rua João Crescêncio, 438 - Madalena;4;5;10;-8.05658; -34.91251 
2024;P346;Praça Professor Coelho de Almeida;Iputinga;Rua Prof. Coelho de Almeida, S/N - Iputinga;4;5;10;-8.04539; -34.93144 
2024;P347;Praça Cordislândia ;Iputinga;Rua Cordislândia, S/N – Iputinga;4;5;10;-8.03966; -34.93494 
2024;P348;Praça Nova Esperança ;Iputinga;Rua Sobral, S/N - Iputinga;4;5;10;-8.03091; -34.93258 
2024;P349;Praça Luiz de Lacerda;Iputinga;Av. Historiador Jordão Emerenciano , S/N - Iputinga;4;5;10;-8.03623; -34.94334 
2024;P350;Escola Professor Leal de Barros;Engenho do Meio;Rua Antônio Borges Uchoa, s/n – Engenho do Meio;4;5;10;-8.05617; -34.94397 
2024;P351;Praça Cosme Viana ;Afogados ;Rua Cosme Viana, s/n – Afogados;5;5;10;-8.06553; -34.9089 
2024;P352;Praça Estevão Sá;Várzea;Rua Caxangá Ágape s/n – Várzea ;4;5;10;-8.03637; -34.94715 
2024;P353;Praça do Bom Pastor;Iputinga;Praça do Bom Pastor, s/n – Iputinga;4;5;10;-8.04815; -34.94021 
2024;P354;Ascendino Neves ;Torre;Rua Ascendino Neves, 30 – Torre;4;5;10;-8.04109; -34.90799 
2024;P355;Praça do Rosário ;Várzea;Rua Francisco Lacerda, S/N - Várzea, ;4;5;10;-8.05062; -34.95838 
2024;P356;Melhor Cantinho da Cidade ;Várzea;Rua Francisco Lacerda, S/N - Várzea;4;5;10;-8.05024; -34.95816 
2024;P357;Praça Pinto Damásio ;Várzea;Av. Afonso Olindense, S/N - Várzea ;4;5;10;-8.04872; -34.95942 
2024;P358;Praça da Várzea;Várzea;Av. Afonso Olindense, S/N – Várzea;4;5;10;-8.04886; -34.95942 
2024;P359;Cemitério da Várzea ;Cidade Universitária ;Av. Prof. Artur de Sá, S/N - Cidade Universitária;4;5;10;-8.04632; -34.95295 
2024;P360;Reitoria UFPE;Cidade Universitária ;Av. Prof. Moraes Rego, 1235 - Cidade Universitária;4;5;10;-8.05223; -34.9457 
2024;P361;Restaurante Universitário (UFPE);Cidade Universitária ;Avenida Professor Paulo Freire, SN - Cidade Universitária;4;5;10;-8.05074; -34.95311 
2024;P362;Calçada do Sport Clube do Recife ;Cidade Universitária ;Rua Benfica, s/n – Ilha do Retiro;4;5;10;-8.06189; -34.90205 
2024;P363;Calçada do metrô de Afogados;Afogados ;Avenida Central, s/n – Afogados ;5;5;10;-8.07775; -34.90681 
2024;P364;Mercado de Afogados;Afogados ;Rua do Acre, s/n – Afogados;5;5;10;-8.07812; -34.90567 
2024;P365;Maternidade Professor Bandeira Filho;Afogados ;Rua Londrina, s/n – Afogados;5;5;10;-8.07908; -34.91115 
2024;P366;Escola Municipal Professor Antônio de Brito Alves;Mustardinha;Rua Ernesto Cavalcanti, 41 – Mustardinha;5;5;10;-8.07399; -34.9179 
2024;P367;T.I Largo da Paz;Afogados ;Avenida Sul, s/n – Afogados;5;5;10;-8.0813; -34.90484 
2024;P368;Hospital da Mulher (Administração);Estância ;Avenida Recife, 5629 – Estância;5;5;10;-8.07214; -34.94077 
2024;P369;Hospital da Mulher (Acesso Funcionários);Estância ;Avenida Recife, 5629 – Estância;5;5;10;-8.07099; -34.94103 
2024;P370;Hospital da Mulher (Emergência);Estância ;Avenida Recife, 5629 – Estância;5;5;10;-8.07167; -34.94057 
2024;P371;Praça do El Salvador;Jardim São Paulo;Rua Aguanil, S/N - Jardim São Paulo;5;5;10;-8.08056; -34.94012 
2024;P372;Praça de San Martin (Praça da Infância);San Martin ;Avenida San Martin, S/N - San Martin;5;5;10;-8.07108; -34.92882 
2024;P373;EREM Professora Helena Pugó;Bongi;Rua Quinze de Março, SN – Bongi;5;10;20;-8.06767; -34.93211 
2024;P374;Praça da Cavalaria 01;San Martin ;Avenida General San Martin, s/n – Bongi;5;5;10;-8.06557; -34.92705 
2024;P375;Praça da Cavalaria 02;San Martin ;Rua Apulcro de Assunção, s/n– Bongi;5;5;10;-8.06539; -34.92755 
2024;P376;Estação Tejipió;Afogados ;Estrada Particular Dr. José Rufino, S/N – Afogados ;5;5;10;-8.09053; -34.95663 
2024;P377;Escola Municipal Professora Maria da Paz Brandão Alves;Sancho;Rua da Felicidade, 51 – Sancho;5;5;10;-8.08243; -34.96149 
2024;P378;Hospital Otávio de Freitas;Tejipió;Rua Aprígio Guimarães, S/N - Tejipió;5;5;10;-8.0869; -34.9618 
2024;P379;Hospital Eduardo Campos da Pessoa Idosa ;Estância ;Avenida Recife, 810 – Estância;5;5;10;-8.10024; -34.92805 
2024;P380;Praça João Stanislau;Areias;Rua Hélio Almeida, S/N - Areias;5;5;10;-8.09724; -34.93564 
2024;P381;Campo de Areias;Areias;Rua Santa Joana D’arc, S/N – Areias;5;5;10;-8.10134; -34.93648 
2024;P382;Praça da Lavadeira ;Areias;Rua Palmares, s/n – Areias;5;5;10;-8.0946; -34.93671 
2024;P383;Mercado de Areias;Areias;Avenida Dr. José Rufino, 1122 – Areias;5;5;10;-8.09755; -34.93838 
2024;P384;Praça Nossa Senhora de Lourdes;Barro ;Rua Exp Sebastião Clementino, S/N - Barro;5;5;10;-8.0955; -34.94383 
2024;P385;Praça 4 de Outubro;Areias;Praça Fernando Galvão, 1 – Areias;5;5;10;-8.09536; -34.93898 
2024;P386;Praça Eduardo Cardoso;Areias;Rua Cap. Gregório de Albuquerque – Areias;5;5;10;-8.09648; -34.93143 
2024;P387;Praça São Braz ;Areias;Rua Cap. Manuel de Aguiar, S/N – Areias;5;5;10;-8.0943; -34.93167 
2024;P388;Praça José Cecílio de Lira;Areias;Rua Cap. Jerônimo Amaral, 142 - Areias;5;5;10;-8.09416; -34.93334 
2024;P389;Praça Manfredo Nigro;Areias;Rua Cap. Vicente Moutinho, 87 – Areias;5;5;10;-8.09342; -34.93251 
2024;P390;Praça Jornalista Anibal Fernandes ;Areias;Rua Cap. Estevão Fernandes, S/N – Areias;5;5;10;-8.09322; -34.93012 
2024;P391;Praça da Vitória ;Areias;Avenida Izabel de Góes, S/N – Areias;5;5;10;-8.09436; -34.93422 
2023;P392;Estação Afogados 01;Afogados;Na entrada da estação - próximo a Rua Mercado de Afogados;5;3;6;-8.07731; -34.90643 
2023;P393;Estação Afogados 02;Afogados;Mercado de afogados;5;2;4;-8.07771; -34.90645 
2023;P394;Praça do Bongi 01;Bongi;Terminal do Bongi -  Rua Doná Maria Augusta Nogueira;5;2;4;-8.06377; -34.92188 
2023;P394;Praça do Bongi 02;Bongi;Terminal do Bongi -  Rua Doná Maria Augusta Nogueira;5;3;6;-8.06377; -34.92188 
2023;P395;Praça Jardim América ;Ipsep;Rua Itacambira 81;6;5;10;-8.06403; -34.92199 
2023;P396;Academia da Cidade Polo Ilha do Leite;Ilha do Leite;Praça Miguel Cervantes, 35;1;5;10;-8.06659; -34.89341 
2023;P397;Escola Municipal Engenheiro Edinaldo Miranda de Oliveira;Encruzilhada;Rua Inácio Galvão dos Santos;2;5;10;-8.03467; -34.89255 
2023;P398;Praça dos Iburenses - Academia Recife;Cohab;Rua Rio Indaiá;6;5;10;-8.1175; -34.94701 
2023;P399;Praça Prof. Calazans;Madalena;Praça Prof. Calazans 215;4;5;10;-8.05054; -34.91022 
2023;P400;Praça João Pessoa de Queiroz;Torrões;Rua Dr. Aniceto Ribeiro Varejão, 273;4;5;10;-8.06736; -34.93278 
2023;P401;Praça Dom Miguel Valverde 01;Encruzilhada;Rua Inácio Galvão dos Santos, lado oposto ao nº196;2;3;6;-8.03541; -34.89258 
2023;P402;Praça Dom Miguel Valverde 02;Encruzilhada;Rua Inácio Galvão dos Santos, lado oposto ao nº264;2;3;6;-8.03583; -34.89248 
2023;P403;Praça Dom Miguel Valverde 03;Encruzilhada;Rua Amaro Coutinho, na calçada da praça.;2;3;6;-8.03568; -34.89277 
2023;P404;Praça dos Taxistas;Cohab;"Ladeira da cohab – lado oposto a Academia da cidade – Polo Praça da Vitória.
";6;3;6;-8.11842; -34.94622 
2023;P405;Praça Chora Menino;Paissandu;"Praça Chora Menino com a Rua Dona Benvinda – Lado Oposto a UNIMED (HUR I)
";1;3;6;-8.06033; -34.89503 
2023;P406;Academia da Cidade Polo Simão Borba;Estância;Rua Ernesto Nazareth, 456 – Vila Tamandaré;5;3;6;-8.09666; -34.92542 
2023;P407;Praça do Burity;Macaxeira; Av. Norte Miguel Arraes de Alencar, 7300;3;5;10;-8.01685; -34.9293 
2023;P408;CRAS Campina do Barreto;Campina do Barreto;Rua Cel. Mario Libório, 263-415;2;5;10;-8.0159; -34.88126 
2023;P419;Campo do Barro ;Ilha Joana Bezerra;Av. Martin Luther King, 368;1;5;10;-8.06888; -34.8994 
2023;P410;Simonesia;Iputinga;R. Francisco Gonçalves Ribeiro;4;3;6;-8.02898; -34.93269 
2024;P410;Simonesia;Iputinga;R. Francisco Gonçalves Ribeiro;4;2;4;-8.02898; -34.93269 
