ano_implantacao;referencia;nome;bairro;local;rpa;quantidade;vagas;latitude;longitude 
2023;P411;Dpt. Remo Do Sport Club Do Recife;Ilha do Retiro;Avenida Beira Rio, lado oposto ao Edf Ilha do Retiro 240;4;5;10;-8.05357; -34.9045 
2023;P412;Praça Eça de Queiroz;Madalena;Rua Pessoa de Melo, em frente ao lote 299 ;4;5;10;-8.05065; -34.90729 
2023;P413;Praça Maciel Pinheiro;Boa Vista;Rua Imperatriz Teresa Cristina, com esquina com a Rua do Hospício;1;5;10;-8.0626; -34.88514 
2023;P414;Mercado de Casa Amarela 04;Casa Amarela;Na entrada principal do mercado.;3;5;10;-8.02591; -34.91775 
2024;P415;TI CDU;Varzea;Avenida Caxangá, 4251;4;8;16;-8.03846; -34.94329 
2023;P416;Centro de Artesanado de Pernambuco;Recife;Av. Alfredo Lisboa - Proximo a entrado do centro, perto do Marco Zero;1;7;14;-8.06272; -34.87079 
2023;P417;TI Getulio Vargas 02;Cordeiro;Av. Getulio Vargas, proximo a entrada de Ônibus;4;10;20;-8.05028; -34.92171 
2023;P418;Parque das Graças 01;Graças;Próximo a Rua Amélia;3;6;12;-8.0454; -34.90291 
2023;P419;Parque das Graças 02;Graças;Próximo a Rua Osvaldo Salsa;3;5;10;-8.04956; -34.90365 
2023;P420;Parque das Graças 03;Graças;Proximo a Rua Anibal Falcão;3;10;20;-8.04801; -34.90278 
2023;P422;CMEI Prof. FRANCISCO do Amaral Lopes ;Santo Amaro;Avenida Gov. Agamenon Magalhães, 2351;1;5;10;-8.0449; -34.88858 
2023;P423;Buriti ;Macaxeira;Rua Ana - Praça Cel. Othon Bezerra de Melo (Terminal de Ônibus do Alto do Buritiy) Rua ;3;5;10;-8.01025; -34.9294 
2001;P424;Academia da Cidade Polo Chão de estrelas;Peixinhos;Avenida Prof. José dos Anjos 504 - Próximo a academia da cidade;2;5;10;-8.02031; -34.87586 
2022;P425;Acad. da cidade – Polo Cafezópolis;Imbiribeira;Rua Des. Agenor Ferreira de Lima – Lado oposto a escola;6;5;10;-8.09982; -34.90885 
2022;P426;Orla de Brasilia Teimosa (Buraco da Véia);Brasília Teimosa;Av. Brasilia Formosa - Buraco da Véia;6;5;10;-8.07995; -34.87659 
2023;P427;TI Caxangá;Várzea;Avenida Caxangá - Dentro do TI caxangá, proximo a entrada dos ônibus;4;3;6;-8.03122; -34.95484 